[
  {
    "voter_id": "the_architect",
    "scores": {
      "task_decomposition": 9,
      "dependency_ordering": 10,
      "decision_point_coverage": 5,
      "test_strategy_quality": 9,
      "agent_assignment": 10
    },
    "overall_score": 9,
    "verdict": "approve",
    "reasoning": "The structural foundation of this plan is excellent, featuring a clean DAG that correctly orders operators before instances and maximizes parallelism. Task decomposition strictly adheres to single responsibility, and agent assignments correctly route all Kubernetes and infrastructure work to Bolt. The only structural weakness is the informal handling of decision points, which lack explicit constraint types.",
    "suggestions": [
      "Formalize the decision point in Task 3 (Terraform vs CLI) by explicitly defining it with options, a constraint type (e.g., 'open' or 'escalation'), and requiring approval before execution.",
      "In Task 8, clarify the exact programmatic mechanism the implementer agent should use to extract the generated passwords from the CloudNative-PG and Redis operator secrets to ensure it can be fully automated."
    ]
  },
  {
    "voter_id": "ThePragmatist",
    "scores": {
      "task_decomposition": 9,
      "dependency_ordering": 10,
      "decision_point_coverage": 8,
      "test_strategy_quality": 10,
      "agent_assignment": 10
    },
    "overall_score": 9,
    "verdict": "approve",
    "reasoning": "The plan demonstrates excellent task decomposition, with tasks appropriately sized for single agents and clear concerns. Dependency ordering maximizes parallelism, and test strategies are specific and cover failure cases. Agent assignments are consistently correct for infrastructure work, leading to a highly executable plan.",
    "suggestions": [
      "Introduce an explicit decision point for the specific Helm chart versions of CloudNative-PG and Redis operators in tasks 1 and 2 to ensure clarity and consistency.",
      "Add a new task after tasks 8 and 9 to deploy a simple 'smoke test' application that consumes the generated `sigma1-infra-credentials` and `sigma1-infra-endpoints` to verify end-to-end connectivity to PostgreSQL, Redis, and S3/R2. This provides an earlier working increment."
    ]
  },
  {
    "voter_id": "the_minimalist",
    "scores": {
      "task_decomposition": 4,
      "dependency_ordering": 9,
      "decision_point_coverage": 4,
      "test_strategy_quality": 8,
      "agent_assignment": 8
    },
    "overall_score": 6,
    "verdict": "revise",
    "reasoning": "The plan suffers from severe administrative bloat by dedicating 25% of its tasks (Tasks 10, 11, and 12) purely to reviewing work that already has explicit test strategies. Additionally, the single decision point identified in Task 3 lacks the required constraint typing, failing to properly structure the ambiguity.",
    "suggestions": [
      "Delete Tasks 10, 11, and 12 entirely; their verification steps are already covered by the test_strategy of the implementation tasks, making these 'review reports' pure waste.",
      "Format the decision point in Task 3 to explicitly include constraint types (e.g., [Open Constraint]) and define clear options for the S3/R2 provisioning tool rather than just mentioning it in the details."
    ]
  }
]
